number,value,datetime_start,datetime_complete,duration,params_base_filters,params_batch_size,params_conv_type,params_dense_units,params_dropout,params_head_pooling,params_kernel_first,params_kernel_other,params_l2_reg,params_label_smoothing,params_learning_rate,params_n_blocks,params_pos_multiplier,params_spatial_dropout,params_use_batch_norm,user_attrs_epochs_ran,user_attrs_fp_per_hour,user_attrs_params,user_attrs_val_auc_pr,user_attrs_val_f1,state
0,0.849218325083345,2026-06-09 22:37:33.438672,2026-06-09 22:43:27.534639,0 days 00:05:54.095967,12,256,conv,64,0.1943752583889521,max,11,5,3.613894271216524e-07,0.018318092164684587,0.001095266274863256,2,1.0797880430957836,0.08736874205941257,False,70.0,8.273777226571584,3273,0.7835669203156641,0.7149455625206202,COMPLETE
1,0.5820841110233327,2026-06-09 22:43:27.551671,2026-06-09 22:50:08.635631,0 days 00:06:41.083960,8,512,separable,48,0.42277452370388513,max,21,5,0.0004869640941520895,0.009799143120957261,0.0010370844668954541,3,0.8150402526674954,0.26844820512829465,False,32.0,21.988993101309976,1958,0.5412587663847582,0.5568047337278107,COMPLETE
2,0.8457112391314155,2026-06-09 22:50:08.645243,2026-06-09 23:14:05.993219,0 days 00:23:57.347976,12,512,separable,0,0.32832278025212885,max,15,7,7.74211647399625e-06,0.035662239361149754,0.00321623546920742,5,0.8554725197197922,0.19126724140656393,False,69.0,8.55282536237501,6868,0.7804395391626509,0.7166038354368136,COMPLETE
3,0.7166932701315643,2026-06-09 23:14:06.005147,2026-06-09 23:44:51.440921,0 days 00:30:45.435774,16,256,separable,48,0.36334806982382817,avg,15,3,2.755546207779658e-07,0.021355389431312818,0.00034695916603302916,5,0.9963157113045242,0.26882738997704797,True,37.0,8.901635532129292,15648,0.6586634835807426,0.6552901023890785,COMPLETE
4,0.8472341799748018,2026-06-09 23:44:51.451596,2026-06-10 00:00:11.163327,0 days 00:15:19.711731,24,512,conv,16,0.44354270434977033,avgmax,7,3,0.00011129571947046003,0.03641081743059298,0.0013865582968261494,3,1.0089288071901195,0.07261658145345012,False,63.0,8.245872412991242,16473,0.7824168798699287,0.7196184838020062,COMPLETE
5,0.7223255120292774,2026-06-10 00:00:11.173536,2026-06-10 00:02:54.988882,0 days 00:02:43.815346,8,512,conv,0,0.23834276026020293,avg,15,7,0.0003880279700786684,0.0316550728636634,0.00014393910893270912,2,1.8705434743123295,0.0725556872701355,False,52.0,8.134253158669871,1057,0.6626796591289841,0.6517438833940656,COMPLETE
6,0.7309527434307488,2026-06-10 00:02:54.999533,2026-06-10 00:34:29.931568,0 days 00:31:34.932035,24,128,separable,32,0.042153645522641614,max,11,3,9.461469059966092e-07,0.019654886233338022,0.0002822090051553569,2,1.9649137211781793,0.11031474091783006,True,80.0,8.608634989535696,3148,0.6737477360057683,0.6325889741800419,COMPLETE
7,0.862727435899445,2026-06-10 00:34:29.986663,2026-06-10 00:43:38.234308,0 days 00:09:08.247645,24,512,conv,16,0.4212696483723514,avg,21,3,2.4474057445796787e-07,0.049502692505213164,0.0009300725537404413,3,1.4995093947089206,0.2088089390024919,False,42.0,5.929772885822805,15657,0.7947353726341193,0.7351094518920753,COMPLETE
8,,2026-06-10 00:43:38.250277,,,12,128,separable,64,0.013725112472572243,avgmax,15,7,2.7590690254397856e-06,0.02611216300274022,0.002497892120906855,4,0.8651786664474501,0.011204456624764325,False,,,9804,,,RUNNING
9,0.8393251567681019,2026-06-10 13:00:30.918030,2026-06-10 13:03:15.650542,0 days 00:02:44.732512,12,256,conv,64,0.1943752583889521,max,11,5,3.613894271216524e-07,0.018318092164684587,0.001095266274863256,2,1.0797880430957836,0.08736874205941257,False,61.0,9.027207193240836,3273,0.7743444300223772,0.7132616487455197,COMPLETE
10,0.7007528300095631,2026-06-10 13:03:15.663567,2026-06-10 13:05:46.051470,0 days 00:02:30.387903,8,512,separable,48,0.42277452370388513,max,21,5,0.0004869640941520895,0.009799143120957261,0.0010370844668954541,3,0.8150402526674954,0.26844820512829465,False,25.0,14.203550112394389,1958,0.6490124661127249,0.6140519730510106,COMPLETE
11,,2026-06-10 13:05:46.064202,2026-06-10 13:05:46.764819,0 days 00:00:00.700617,24,256,conv,16,0.33858174795150664,avg,21,7,1.5434592296056876e-06,0.04561039135110496,0.0012531222466214444,3,1.798517960333804,0.14867223952295686,False,,,34089,,,PRUNED
12,0.9210545680802324,2026-06-10 13:05:46.775707,2026-06-10 13:13:54.497469,0 days 00:08:07.721762,24,512,conv,16,0.19822490234915685,avg,21,3,1.5241993986526777e-07,0.04411473973789725,0.0003699703989467569,3,1.1762065155108532,0.12288931791063963,True,80.0,6.878536547554454,16089,0.8489422808050571,0.783068783068783,COMPLETE
13,,2026-06-10 13:13:54.527330,2026-06-10 13:13:55.360093,0 days 00:00:00.832763,24,512,conv,32,0.31103038417885387,avg,21,3,2.0145644406009053e-07,0.04215482133572112,0.000744292680780022,5,1.2434455868755852,0.2608826802450553,False,,,73889,,,PRUNED
14,0.6405692100524902,2026-06-10 13:13:55.374339,2026-06-10 13:14:43.054016,0 days 00:00:47.679677,8,512,conv,16,0.28229723476243856,avg,21,3,1.980059037161301e-07,0.027754512521937707,0.00021277349256542186,3,1.2643578502482893,0.09264124474139918,True,,,2313,,,PRUNED
15,0.7370187707109148,2026-06-10 13:14:43.068435,2026-06-10 13:15:29.704013,0 days 00:00:46.635578,24,512,conv,16,0.41326720190268973,avg,21,3,1.398243419541128e-07,0.038850276633716506,0.0011651572203508515,2,1.400949931252023,0.2360814045034282,False,12.0,7.576156887063019,4833,0.6752763490452426,0.6727649292371418,COMPLETE
16,,2026-06-10 13:15:29.717400,2026-06-10 13:15:30.639120,0 days 00:00:00.921720,24,512,conv,16,0.16059528570242035,avg,21,7,2.0253996498028382e-07,0.048108723213871024,0.00026200619740843336,4,1.2077694682507083,0.13966991824463165,True,,,83673,,,PRUNED
17,0.5937613844871521,2026-06-10 13:15:30.651859,2026-06-10 13:16:51.946323,0 days 00:01:21.294464,16,512,conv,16,0.41053148424399183,avgmax,7,3,1.3351961097772654e-07,0.044758729362883554,0.00011111593752360097,3,1.5980396699470019,0.17752509323759327,False,,,7921,,,PRUNED
18,0.7293005585670471,2026-06-10 13:16:51.959484,2026-06-10 13:20:21.656538,0 days 00:03:29.697054,24,512,separable,0,0.27151082061163057,avgmax,21,3,2.4161960206003796e-07,0.04674821739221459,0.0006965081331429603,3,1.151872053379785,0.08993344865080583,True,,,5590,,,PRUNED
19,0.5682650804519653,2026-06-10 13:20:21.670028,2026-06-10 13:22:44.382183,0 days 00:02:22.712155,12,512,separable,16,0.40263952363920336,avg,21,3,7.134547254970882e-06,0.04710561285261103,0.000169299536994476,4,1.538681328655043,0.2822809092085192,False,,,4050,,,PRUNED
20,,2026-06-10 13:22:44.395867,2026-06-10 13:22:45.388445,0 days 00:00:00.992578,24,128,conv,16,0.3374829737129044,avgmax,11,3,1.5737233972424398e-06,0.048846063439751834,0.0025424939704009534,4,1.0887073728246959,0.17449694551085063,True,,,38889,,,PRUNED
21,,2026-06-10 13:22:45.403285,2026-06-10 13:22:46.395914,0 days 00:00:00.992629,24,512,conv,48,0.3168832953314514,avg,15,5,2.3255440595446147e-07,0.04822599689510377,0.0013115538340896283,3,1.401910209405463,0.111976931431867,False,,,27097,,,PRUNED
22,,2026-06-10 13:22:46.409465,2026-06-10 13:22:47.344137,0 days 00:00:00.934672,32,512,conv,64,0.2843932486735407,avg,11,3,2.998978309648032e-07,0.0417641732648003,0.0004929298862788933,3,1.0479372957867465,0.23145707351332667,True,,,31969,,,PRUNED
23,0.8956390747563403,2026-06-10 13:22:47.356799,2026-06-10 13:32:15.322193,0 days 00:09:27.965394,24,128,conv,16,0.11920581538433442,avg,11,3,5.656048972402333e-07,0.04261093331270166,0.00027917146847586166,3,1.1759253204494313,0.16066935223124745,True,80.0,8.1203007518797,15849,0.8267269654599363,0.7591054313099042,COMPLETE
24,0.6860703229904175,2026-06-10 13:32:15.342161,2026-06-10 13:33:35.048301,0 days 00:01:19.706140,16,128,conv,16,0.06034755249829776,avg,7,3,6.003985694804885e-07,0.040676269120747365,0.00029841011190052675,3,1.193217556513008,0.16586285696908096,False,,,7153,,,PRUNED
25,0.6625009179115295,2026-06-10 13:33:35.060726,2026-06-10 13:35:02.101678,0 days 00:01:27.040952,24,128,conv,32,0.0173062567756425,avg,11,3,1.017855903748911e-06,0.032606208231678306,0.0003542054140811501,3,0.9167592068393018,0.2789817827370997,True,,,17033,,,PRUNED
26,0.5720340609550476,2026-06-10 13:35:02.115430,2026-06-10 13:39:41.913393,0 days 00:04:39.797963,24,128,separable,48,0.13033248955175603,avg,11,3,6.172627031710999e-07,0.04359722495075231,0.00014103939654266204,3,1.2901992912537863,0.15519268091075547,True,,,8988,,,PRUNED
27,,2026-06-10 13:39:41.926312,2026-06-10 13:39:43.113611,0 days 00:00:01.187299,24,128,conv,16,0.10019059449922522,avg,15,3,1.597942252827233e-07,0.03238975529567006,0.00014810161766462676,4,1.6072609840738261,0.0649472312012414,True,,,37449,,,PRUNED
28,0.8587228018858145,2026-06-10 13:39:43.127202,2026-06-10 13:44:49.637803,0 days 00:05:06.510601,12,256,conv,64,0.42651232973239955,avg,21,3,3.19059942988456e-07,0.04195579911555326,0.0013012760150616207,4,1.2697769991001304,0.16148709802286065,False,50.0,9.920161227811798,12213,0.7937726322589602,0.7278491044539547,COMPLETE
29,0.6797239184379578,2026-06-10 13:44:49.653532,2026-06-10 13:46:14.100976,0 days 00:01:24.447444,24,512,conv,64,0.2664498829793909,max,15,3,1.9594391632819537e-06,0.04168965349474911,0.00018490153510764416,3,1.2981713935584118,0.13092153594061964,True,,,19497,,,PRUNED
30,0.7464498281478882,2026-06-10 13:46:14.118442,2026-06-10 13:47:19.339610,0 days 00:01:05.221168,12,512,conv,0,0.355053865857923,avg,21,7,1.752392613466709e-07,0.04765220551337727,0.0014474533591164968,3,1.4592021966248416,0.18318988854455995,True,,,8641,,,PRUNED
31,0.9303417179699032,2026-06-10 13:47:19.359278,2026-06-10 13:53:38.251318,0 days 00:06:18.892040,32,128,conv,16,0.020915914911376343,avgmax,11,7,1.1921685840062799e-06,0.035628460259725526,0.0005432169070519357,2,0.8940055354265939,0.11731071104652477,True,63.0,7.924967056817302,17153,0.8578635308359761,0.7947679850513859,COMPLETE
32,0.9232061004925727,2026-06-10 13:53:38.277137,2026-06-10 13:59:52.716555,0 days 00:06:14.439418,32,128,conv,16,0.03278026519260341,avgmax,11,7,6.462463569987112e-06,0.03815638231556319,0.0008777001931206243,2,0.839745504551615,0.14564325755983248,True,60.0,8.34353926052244,17153,0.8518278794768745,0.7865588052271313,COMPLETE
33,,2026-06-10 13:59:52.735089,2026-06-10 13:59:55.347967,0 days 00:00:02.612878,32,128,conv,16,0.022339099065993493,avgmax,11,7,4.061327601170414e-06,0.026587327502945266,0.001896220684821697,3,0.9492434769593829,0.13973267692814764,True,,,61569,,,PRUNED
34,0.9120270762189078,2026-06-10 13:59:55.361239,2026-06-10 14:05:29.670567,0 days 00:05:34.309328,32,256,conv,16,0.005245714659974383,avgmax,11,7,5.041247863749552e-06,0.03659110025835801,0.00045058185360047804,2,0.7203538537496998,0.15371592864809944,False,51.0,6.19486861483606,16865,0.8400222231363002,0.7782126549249837,COMPLETE
35,,2026-06-10 14:05:29.683055,2026-06-10 14:05:30.867139,0 days 00:00:01.184084,32,256,conv,16,0.028514516422287937,avgmax,11,7,6.494515911628439e-07,0.04662250454847097,0.00018595568330764424,3,0.8111298657088281,0.1393714972340778,False,,,60993,,,PRUNED
36,0.9324863182749206,2026-06-10 14:05:30.879510,2026-06-10 14:11:52.972674,0 days 00:06:22.093164,24,256,conv,16,0.0992583606884738,avgmax,21,7,3.458922223313008e-06,0.027407000105112093,0.0006944342466480789,2,0.7174472465188223,0.16273981977087354,False,75.0,7.827300209286102,10209,0.8599175752771897,0.7880784313725491,COMPLETE
37,0.9087412657230378,2026-06-10 14:11:52.995229,2026-06-10 14:18:35.625371,0 days 00:06:42.630142,32,128,conv,32,0.12394281387786005,avgmax,7,7,6.904130313099968e-06,0.047418539721092,0.0006740890864464907,2,0.8879582442868285,0.1567044494727064,True,80.0,8.148205565460042,19105,0.8389225308684638,0.77161371898214,COMPLETE
38,0.9322268638285616,2026-06-10 14:18:35.640242,2026-06-10 14:32:41.642780,0 days 00:14:06.002538,24,128,conv,16,0.07840632271409512,avgmax,21,3,2.3974132884673562e-05,0.024236699999802255,0.0007454315576084152,3,0.9063733707916206,0.18128721055586894,False,63.0,7.213394310518565,16809,0.859075974806033,0.7964071856287425,COMPLETE
39,,2026-06-10 14:32:41.656431,2026-06-10 14:32:42.847528,0 days 00:00:01.191097,24,128,conv,16,0.08772556758110778,avgmax,21,3,3.052663301710822e-05,0.023898134194106944,0.0006043101135789182,4,0.8755628275437911,0.1717772051774154,False,,,38409,,,PRUNED
40,,2026-06-10 14:32:42.860446,2026-06-10 14:32:43.993436,0 days 00:00:01.132990,24,256,conv,16,0.1658290304643507,avgmax,21,7,2.5100881662531203e-07,0.016490191735053804,0.001334714448169466,3,0.892935406750111,0.22757299778388917,False,,,35241,,,PRUNED
41,0.678673505783081,2026-06-10 14:32:44.009047,2026-06-10 14:35:44.441887,0 days 00:03:00.432840,24,256,separable,16,0.09296532037367868,avgmax,21,7,2.204747510762093e-05,0.0243625372426689,0.0005156035494889253,2,1.0382499606923878,0.19001342896333795,False,,,3006,,,PRUNED
42,0.8320128917694092,2026-06-10 14:35:44.452267,2026-06-10 14:41:08.468086,0 days 00:05:24.015819,24,256,conv,16,0.11351656695312162,avgmax,15,3,9.557174610835405e-07,0.02110918905799043,0.0005237533399650001,2,1.1913880542068247,0.08429889612463765,False,,,5457,,,PRUNED
43,0.7240005731582642,2026-06-10 14:41:08.482426,2026-06-10 14:41:52.723843,0 days 00:00:44.241417,8,128,conv,16,0.04035276912255917,max,11,7,3.050146902148515e-07,0.04437461051900587,0.0008985961913823457,2,0.9522750635363797,0.08877252442198164,True,,,1369,,,PRUNED
44,0.7305563688278198,2026-06-10 14:41:52.737771,2026-06-10 14:42:34.455492,0 days 00:00:41.717721,12,128,conv,16,0.13112383268739414,avgmax,11,5,1.4989764576920145e-06,0.04334181596097558,0.0008096454130558327,2,1.0499025610815487,0.1266955542959634,True,,,2517,,,PRUNED
45,0.8152952790260315,2026-06-10 14:42:34.466859,2026-06-10 14:46:21.332077,0 days 00:03:46.865218,32,512,conv,0,0.03980633053370696,avgmax,15,7,2.1804680102534356e-07,0.03379851814592329,0.000300312169200748,2,0.8007786214811745,0.15596806019544823,True,,,15329,,,PRUNED
46,0.8118007183074951,2026-06-10 14:46:21.349416,2026-06-10 14:48:51.096931,0 days 00:02:29.747515,16,512,conv,16,0.091294007589006,avgmax,21,3,9.27608065171237e-06,0.03146394656145617,0.001921134262396615,2,0.8491198020799241,0.15036986680043202,False,,,2977,,,PRUNED
47,0.9269303708874225,2026-06-10 14:48:51.112219,2026-06-10 14:58:03.372139,0 days 00:09:12.259920,24,256,conv,16,0.19730552304770083,avg,21,3,1.615184408084977e-07,0.04593911608356982,0.0005061702662656044,3,1.0744198731175503,0.1194018253028523,False,80.0,7.338965971630107,15657,0.8542983800611813,0.7909033480732786,COMPLETE
48,0.9120191352731853,2026-06-10 14:58:03.385900,2026-06-10 15:09:28.283829,0 days 00:11:24.897929,24,128,conv,0,0.06873826550630244,avgmax,21,5,1.2421287685239211e-06,0.03314226186055622,0.001223630423534371,2,0.7277904845397887,0.16912317689391304,False,64.0,5.594915122858693,6433,0.8392319872470577,0.7716039144136673,COMPLETE
49,,2026-06-10 15:09:28.298390,2026-06-10 15:09:29.602232,0 days 00:00:01.303842,24,256,conv,0,0.26824494527210385,avg,21,7,1.673942959191393e-07,0.04885420290395257,0.0002552887924169585,3,0.9768913806658216,0.06797702874371299,False,,,32977,,,PRUNED
50,0.8091262578964233,2026-06-10 15:09:29.613060,2026-06-10 15:14:01.394117,0 days 00:04:31.781057,16,256,conv,16,0.3071213515029015,avg,15,3,1.3158180065643776e-07,0.04678567764997473,0.0013938302101993397,3,0.7849233328630787,0.10407747680299483,False,,,7281,,,PRUNED
51,0.8366407155990601,2026-06-10 15:14:01.409391,2026-06-10 15:20:52.602037,0 days 00:06:51.192646,32,128,conv,32,0.05034661871247643,avgmax,11,3,4.1518771839552916e-07,0.02396581778224196,0.0003321197615117964,2,0.7706247528780612,0.034604119220774984,False,,,10753,,,PRUNED
52,0.9261745242363704,2026-06-10 15:20:52.614716,2026-06-10 15:24:14.748508,0 days 00:03:22.133792,24,512,conv,16,0.17018925328610254,avg,21,3,4.039711590737367e-07,0.04979152937371119,0.0007024265544284871,2,1.4118183749392785,0.0705137075588865,True,80.0,6.794822106813426,5049,0.8519934943562457,0.7921581128466688,COMPLETE
53,0.9427441761120408,2026-06-10 15:24:14.764765,2026-06-10 15:27:37.411309,0 days 00:03:22.646544,24,256,conv,16,0.006111520736716072,avgmax,21,7,1.8656854242170533e-06,0.03228183409900478,0.0009977809394102024,2,0.823476295712817,0.11960157509444524,True,50.0,7.436632819161306,10425,0.8681962301100509,0.8054820121476406,COMPLETE
54,0.9405164244965191,2026-06-10 15:27:37.434098,2026-06-10 15:31:32.848803,0 days 00:03:55.414705,24,256,conv,16,0.12424351886194478,avgmax,21,7,2.1952862591561054e-06,0.018975893572314467,0.0008868071186700012,2,1.0180928471256703,0.08072049236002435,True,62.0,7.631966514223704,10425,0.8662367732306143,0.8041012894205375,COMPLETE
55,0.7546324133872986,2026-06-10 15:31:32.862307,2026-06-10 15:32:29.753748,0 days 00:00:56.891441,24,256,conv,64,0.26325783307914297,avgmax,7,7,9.904094761185725e-07,0.014669702825848317,0.000833247577353155,2,1.2187696538162678,0.04821650866943113,True,,,14793,,,PRUNED
56,,2026-06-10 15:32:29.768660,2026-06-10 15:32:31.295016,0 days 00:00:01.526356,24,256,conv,16,0.14764094704863961,avgmax,21,7,5.302512171654594e-06,0.030003646760713085,0.0009190470715987408,3,1.2503906131003946,0.04692405979989345,True,,,35673,,,PRUNED
57,0.9524292188370796,2026-06-10 15:32:31.306417,2026-06-10 15:35:58.166593,0 days 00:03:26.860176,24,256,conv,64,0.016170956267844025,avgmax,21,7,7.700614906956185e-07,0.03463853348855276,0.001982689423584563,2,0.7915487199136244,0.15479931778324676,True,53.0,7.26920393767925,15129,0.8769827207098934,0.818055340856392,COMPLETE
58,0.9062545100480869,2026-06-10 15:35:58.187868,2026-06-10 15:37:53.968309,0 days 00:01:55.780441,12,256,conv,64,0.031547841714642755,max,21,7,1.794741905638291e-06,0.038092526145082614,0.003986722983944476,2,0.9302843827491877,0.14011086553077937,True,49.0,6.990155801875824,4077,0.8351581979928521,0.7616411592315206,COMPLETE
59,,2026-06-10 15:37:53.983365,2026-06-10 15:37:55.568351,0 days 00:00:01.584986,24,512,conv,64,0.09166627006427716,avgmax,21,7,5.023038906854678e-06,0.03027473406608108,0.0030114253176799274,3,1.0924500576822707,0.2530818714655074,True,,,42681,,,PRUNED
60,,2026-06-10 15:37:55.579773,2026-06-10 15:37:57.120177,0 days 00:00:01.540404,32,256,conv,16,0.06459430220973869,avg,21,7,2.490263276880824e-07,0.00439606214279375,0.0006842817852919968,3,1.0741503086898223,0.13183714570171903,True,,,60353,,,PRUNED
