number,value,datetime_start,datetime_complete,duration,params_batch_size,params_conv_type,params_dense_units,params_dilation_base,params_dropout,params_filters,params_head_pooling,params_kernel_size,params_l2_reg,params_label_smoothing,params_learning_rate,params_n_blocks,params_padding,params_pos_multiplier,params_spatial_dropout,params_use_batch_norm,user_attrs_epochs_ran,user_attrs_fp_per_hour,user_attrs_params,user_attrs_val_auc_pr,user_attrs_val_f1,state
72,,2026-06-09 19:03:15.200191,2026-06-09 19:03:26.837980,0 days 00:00:11.637789,512.0,separable,32,2,0.12338601871966974,16,avg,7,4.552992497019918e-06,0.03375573449046092,0.00045426531268101707,6,same,0.7174014073928273,0.07639721681694017,False,,,4545.0,,,FAIL
73,,2026-06-09 19:03:26.886053,2026-06-09 19:03:38.472357,0 days 00:00:11.586304,128.0,separable,48,2,0.042509317302309134,12,avg,9,4.210843376363288e-06,0.03764602031169467,0.000517506210352182,4,same,0.8114638899049763,0.07829951485775347,False,,,2377.0,,,FAIL
74,,2026-06-09 19:03:38.487636,2026-06-09 19:03:50.175771,0 days 00:00:11.688135,512.0,separable,0,3,0.10039286244953038,32,avg,11,4.654586350040408e-06,0.046331349649012615,0.0005088243383594819,6,same,0.7134381929526498,0.0848937956386048,False,,,14881.0,,,FAIL
75,,2026-06-09 19:03:50.187307,2026-06-09 19:04:01.857606,0 days 00:00:11.670299,512.0,separable,8,2,0.1178809496003867,16,avg,7,6.644022319354528e-07,0.029604743830352442,0.00039383343833777754,6,same,0.8514156879067295,0.03506054207711885,True,,,4689.0,,,FAIL
76,,2026-06-09 19:04:01.867491,2026-06-09 19:04:16.333936,0 days 00:00:14.466445,512.0,separable,24,3,0.020309584840700404,32,avg,7,2.6993431408622744e-05,0.024328591944325656,0.0019980191798203645,6,same,0.8653129732147611,0.08361082177857054,False,,,14897.0,,,FAIL
77,,2026-06-09 19:04:16.343669,2026-06-09 19:04:27.982239,0 days 00:00:11.638570,512.0,separable,48,2,0.05437181896571769,12,avg,7,1.5194089561500263e-07,0.04659744116527399,0.0015959522935835844,5,same,0.9149656914438987,0.019158126619183237,True,,,3037.0,,,FAIL
78,,2026-06-09 19:04:27.991793,2026-06-09 19:04:39.586630,0 days 00:00:11.594837,1024.0,separable,8,3,0.04495954847471012,32,avg,7,1.2085015772904805e-06,0.03686879918516204,0.00039020723906140224,5,same,0.8199546668638754,0.011837663479279427,False,,,12017.0,,,FAIL
79,,2026-06-09 19:04:39.596215,2026-06-09 19:04:51.199935,0 days 00:00:11.603720,1024.0,separable,16,3,0.011817506293702353,32,avg,7,4.551716977224325e-06,0.040197664298239524,0.00047379697276521074,5,same,0.7052134645236308,0.03508681258163357,False,,,12289.0,,,FAIL
80,,2026-06-09 19:04:51.210568,2026-06-09 19:05:02.858853,0 days 00:00:11.648285,512.0,separable,24,2,0.034834750295421005,32,avg,9,1.1932194284518514e-06,0.04716965033851646,0.0007717488559727117,5,same,0.7888807900774479,0.012842223772779326,False,,,12881.0,,,FAIL
81,,2026-06-09 19:05:02.869219,2026-06-09 19:05:14.504361,0 days 00:00:11.635142,512.0,separable,48,2,0.06356895553430354,32,avg,5,1.9851220293612717e-07,0.038275241048179184,0.0036354128091921605,6,same,1.0411597953559906,0.05014222501194509,False,,,15329.0,,,FAIL
82,,2026-06-09 19:05:14.514621,2026-06-09 19:05:26.213112,0 days 00:00:11.698491,512.0,separable,8,2,0.1308869692429065,32,avg,3,6.220812832493024e-07,0.03321432334249506,0.0004587749838322477,5,same,0.8645406195802428,0.0904940053879633,True,,,12337.0,,,FAIL
83,,2026-06-09 19:05:26.265418,2026-06-09 19:05:37.868064,0 days 00:00:11.602646,128.0,separable,24,3,0.08686280908828027,32,max,9,1.0266352712260587e-06,0.04127166422522409,0.00041068907957934935,5,same,0.7801815080498844,0.04652531631846552,False,,,12881.0,,,FAIL
84,,2026-06-09 19:05:37.877711,2026-06-09 19:05:49.514651,0 days 00:00:11.636940,512.0,separable,48,2,0.16384214919626702,12,avg,11,1.8378229418759377e-07,0.026732450529931166,0.0014391918443767162,5,same,0.8463961993090735,0.023804378850701788,True,,,3277.0,,,FAIL
85,,2026-06-09 19:05:49.526566,2026-06-09 19:06:01.141075,0 days 00:00:11.614509,512.0,separable,48,2,0.19224140563865377,16,avgmax,7,3.4990868268154333e-07,0.02346070451580428,0.0012217032978001866,6,same,0.7226475601065081,0.03678314655385905,False,,,5601.0,,,FAIL
86,,2026-06-09 19:06:01.151834,2026-06-09 19:06:12.800208,0 days 00:00:11.648374,512.0,separable,32,2,0.02709163959886876,32,avgmax,7,4.6456705043385745e-07,0.016988164074423693,0.0010611787752397642,6,same,0.7419686979019706,0.009351239895583792,True,,,17345.0,,,FAIL
87,,2026-06-09 19:06:12.810487,2026-06-09 19:06:24.444930,0 days 00:00:11.634443,512.0,separable,32,3,0.034161986843883704,32,avg,7,3.133702702458901e-05,0.02497127510309584,0.0009838327027472378,6,same,1.1112192121696811,0.07300512521950459,False,,,15169.0,,,FAIL
88,,2026-06-09 19:06:24.456875,2026-06-09 19:06:38.970748,0 days 00:00:14.513873,512.0,separable,8,3,0.13821159603755648,32,avg,5,2.772793488706682e-07,0.04641074041289901,0.0003304117353423458,6,same,0.7310180349139902,0.01420675541116247,False,,,13969.0,,,FAIL
